{
  "api_version": "metactl/v2alpha1",
  "kind": "library_stack",
  "id": "fixture-multi-baseline",
  "version": "1.0.0",
  "title": "Fixture multi-baseline",
  "active_profile_ref": "default",
  "sources": [
    {
      "kind": "library_source",
      "id": "org-baseline",
      "version": "1.0.0",
      "title": "org-baseline",
      "source_role": "baseline",
      "read_only": true,
      "writable": false,
      "pinned": true,
      "visibility_scope": "shared",
      "trust_tier": "org_validated",
      "source": {
        "type": "local_path",
        "path": "sources/org-baseline",
        "digest": "sha256:62665ee14ebd6a54da51753cb025303f15b85ad7094a1bd4e9d980d2e0dc25fe"
      },
      "artifacts": [
        {
          "artifact_ref": {
            "kind": "policy",
            "id": "release-policy",
            "version": "1.0.0"
          },
          "digest": "sha256:ca9eb8a3f8895a2f7132f557eb0b302478d76f81095260ccce4564aba35f0884",
          "source_path": "packs/release-policy.json"
        }
      ]
    },
    {
      "kind": "library_source",
      "id": "team-baseline",
      "version": "1.0.0",
      "title": "team-baseline",
      "source_role": "baseline",
      "read_only": true,
      "writable": false,
      "pinned": true,
      "visibility_scope": "shared",
      "trust_tier": "org_validated",
      "source": {
        "type": "local_path",
        "path": "sources/team-baseline",
        "digest": "sha256:3b8808ffdb018afa1dde0a03bdf7374fa4dbb18158bb6a229f6e4b4fc4ff8a0a"
      },
      "artifacts": [
        {
          "artifact_ref": {
            "kind": "pack",
            "id": "team-pack",
            "version": "1.0.0"
          },
          "digest": "sha256:df7cfdf019b6cd83219f2b42b3aa186acc9195659a3e68d53263896fa1da8eda",
          "source_path": "packs/team-pack.json"
        }
      ]
    },
    {
      "kind": "library_source",
      "id": "user-overlay",
      "version": "1.0.0",
      "title": "user-overlay",
      "source_role": "overlay",
      "read_only": false,
      "writable": true,
      "pinned": true,
      "visibility_scope": "private",
      "trust_tier": "first_party_validated",
      "source": {
        "type": "local_path",
        "path": "sources/user-overlay",
        "digest": "sha256:f247c381275c94b191008c3884a6d1dabdfdde465009df019cb62977affd1f5d"
      },
      "artifacts": [
        {
          "artifact_ref": {
            "kind": "pack",
            "id": "user-pack",
            "version": "1.0.0"
          },
          "digest": "sha256:c1001d372471d3640982ea8ca930a9aa24c4299c3e9107ea49b3ddf4ef7ce432",
          "source_path": "packs/user-pack.json"
        }
      ]
    }
  ],
  "profiles": [
    {
      "kind": "library_profile",
      "id": "default",
      "version": "1.0.0",
      "title": "default",
      "baseline_refs": [
        "org-baseline",
        "team-baseline"
      ],
      "overlay_ref": "user-overlay",
      "baseline_precedence": "fail_on_conflict",
      "default_targets": [
        "codex-cli"
      ]
    }
  ]
}
