{
  "api_version": "metactl/v2alpha1",
  "kind": "library_stack",
  "id": "fixture-locked-conflict",
  "version": "1.0.0",
  "title": "Fixture locked-conflict",
  "active_profile_ref": "default",
  "sources": [
    {
      "kind": "library_source",
      "id": "org-baseline",
      "version": "1.0.0",
      "title": "org-baseline",
      "source_role": "baseline",
      "read_only": true,
      "writable": false,
      "pinned": true,
      "visibility_scope": "shared",
      "trust_tier": "org_validated",
      "source": {
        "type": "local_path",
        "path": "sources/org-baseline",
        "digest": "sha256:62665ee14ebd6a54da51753cb025303f15b85ad7094a1bd4e9d980d2e0dc25fe"
      },
      "artifacts": [
        {
          "artifact_ref": {
            "kind": "pack",
            "id": "release-guard",
            "version": "1.0.0"
          },
          "digest": "sha256:250436be394b32061750a4b0aad687dbd81912033a97e499aa3ea6c5fa37db28",
          "source_path": "packs/release-guard.json",
          "locked": true
        }
      ]
    },
    {
      "kind": "library_source",
      "id": "user-overlay",
      "version": "1.0.0",
      "title": "user-overlay",
      "source_role": "overlay",
      "read_only": false,
      "writable": true,
      "pinned": true,
      "visibility_scope": "private",
      "trust_tier": "first_party_validated",
      "source": {
        "type": "local_path",
        "path": "sources/user-overlay",
        "digest": "sha256:f247c381275c94b191008c3884a6d1dabdfdde465009df019cb62977affd1f5d"
      },
      "artifacts": [
        {
          "artifact_ref": {
            "kind": "pack",
            "id": "release-guard",
            "version": "1.0.1"
          },
          "digest": "sha256:ccf2c77f9cc6a261e88321ecc33d425c1182f1e2577ab126dfd76bc1fae256ae",
          "source_path": "packs/release-guard.json"
        }
      ]
    }
  ],
  "profiles": [
    {
      "kind": "library_profile",
      "id": "default",
      "version": "1.0.0",
      "title": "default",
      "baseline_refs": [
        "org-baseline"
      ],
      "overlay_ref": "user-overlay",
      "baseline_precedence": "fail_on_conflict",
      "default_targets": [
        "codex-cli"
      ]
    }
  ]
}
